{
  "$schema": "https://json-schema.org/draft/2020-12/schema",
  "$id": "cognitive-runtime.active-generation-pointer/v3",
  "title": "Composite Active Generation Pointer",
  "type": "object",
  "additionalProperties": false,
  "required": ["schema_version", "instance_id", "generation_id", "source_revision", "authority", "domains", "manifest_checksum", "activation_receipt_id", "activated_at"],
  "properties": {
    "schema_version": { "const": "cognitive-runtime.active-generation-pointer/v3" },
    "instance_id": { "$ref": "#/$defs/id" },
    "generation_id": { "$ref": "#/$defs/generation" },
    "source_revision": { "$ref": "#/$defs/authorityRevision" },
    "authority": { "$ref": "#/$defs/authority" },
    "domains": { "$ref": "#/$defs/domains" },
    "manifest_checksum": { "$ref": "#/$defs/checksum" },
    "activation_receipt_id": { "$ref": "#/$defs/id" },
    "activated_at": { "type": "string", "format": "date-time" }
  },
  "$defs": {
    "id": { "type": "string", "pattern": "^[a-z0-9][a-z0-9._-]{0,127}$" },
    "authorityRevision": { "type": "string", "pattern": "^[a-f0-9]{40}$" },
    "sourceRevision": { "type": "string", "pattern": "^[A-Za-z0-9][A-Za-z0-9._:-]{0,255}$" },
    "generation": { "type": "string", "pattern": "^generation-[a-f0-9]{64}$" },
    "projectionRevision": { "type": "string", "pattern": "^projection-[a-f0-9]{64}$" },
    "pointerRevision": { "type": "string", "pattern": "^pointer-[a-f0-9]{64}$" },
    "checksum": { "type": "string", "pattern": "^sha256:[a-f0-9]{64}$" },
    "authority": { "type": "object", "additionalProperties": false, "required": ["revision", "checksum"], "properties": { "revision": { "$ref": "#/$defs/authorityRevision" }, "checksum": { "$ref": "#/$defs/checksum" } } },
    "domain": { "type": "object", "additionalProperties": false, "required": ["domain_id", "status", "projection_revision", "pointer_revision", "manifest_checksum", "source_revision", "as_of"], "properties": { "domain_id": { "$ref": "#/$defs/id" }, "status": { "enum": ["active", "stale"] }, "projection_revision": { "$ref": "#/$defs/projectionRevision" }, "pointer_revision": { "$ref": "#/$defs/pointerRevision" }, "manifest_checksum": { "$ref": "#/$defs/checksum" }, "source_revision": { "$ref": "#/$defs/sourceRevision" }, "as_of": { "type": "string", "format": "date-time" } } },
    "domains": { "type": "array", "minItems": 1, "maxItems": 32, "items": { "$ref": "#/$defs/domain" } }
  }
}
