{"schema_version":"cognitive-runtime.active-generation-pointer/v3","instance_id":"instance-synthetic","generation_id":"generation-aaaaaaaaaaaaaaaaaaaaaaaaaaaaaaaaaaaaaaaaaaaaaaaaaaaaaaaaaaaaaaaa","source_revision":"aaaaaaaaaaaaaaaaaaaaaaaaaaaaaaaaaaaaaaaa","authority":{"revision":"aaaaaaaaaaaaaaaaaaaaaaaaaaaaaaaaaaaaaaaa","checksum":"sha256:0000000000000000000000000000000000000000000000000000000000000000"},"domains":[{"domain_id":"fitness","status":"active","projection_revision":"projection-1111111111111111111111111111111111111111111111111111111111111111","pointer_revision":"pointer-2222222222222222222222222222222222222222222222222222222222222222","manifest_checksum":"sha256:3333333333333333333333333333333333333333333333333333333333333333","source_revision":"fitness-1","as_of":"2026-08-24T00:00:00Z"}],"manifest_checksum":"sha256:4444444444444444444444444444444444444444444444444444444444444444","activation_receipt_id":"activation-synthetic-v3","activated_at":"2026-08-24T00:02:00Z"}
